{
  "blockers": [],
  "evidence_sha256": "19291d79bd800fdb76d96656f9f150ee3114dbcde08d2e82415aff7ff747816a",
  "generated_at": "2026-08-23T18:40:00Z",
  "schema_version": 1,
  "source_sha": "e8e7e83c107bdb8bcb29882936720bc9eeb1c246",
  "status": "pass",
  "subdivisions": [
    {
      "accepted_head": "dfde39746f0ec909a865a9f0ef75b6856e77c88f",
      "evidence_bytes": 5325,
      "evidence_sha256": "7d29ec1bb291f47619569e121e725b9d34dc4900e8e25d14288ee8f2c5d6bb8f",
      "manual_evidence_bytes": null,
      "manual_evidence_sha256": null,
      "manual_reason": "No manual intervention is defined for the transport-independent R9.1 foundation.",
      "manual_satisfied": true,
      "manual_state": "none",
      "source": "docs/roadmap/R9_1_ACCEPTANCE.md",
      "status": "pass",
      "subdivision": "R9.1"
    },
    {
      "accepted_head": "15186ced206f05d8baf764738615e6625aa6d459",
      "evidence_bytes": 5452,
      "evidence_sha256": "1dff42053d31a8772c44aae883fff6d83127007dc0135aded9ea1cf7f1d412d7",
      "manual_evidence_bytes": null,
      "manual_evidence_sha256": null,
      "manual_reason": "The R9.2 conditional was not triggered; hosted deterministic transport fixtures exercised the accepted client paths.",
      "manual_satisfied": true,
      "manual_state": "conditional_not_triggered",
      "source": "docs/roadmap/R9_2_ACCEPTANCE.md",
      "status": "pass",
      "subdivision": "R9.2"
    },
    {
      "accepted_head": "915075149fa81b31308c3eedcfa35e74f8a9b7a4",
      "evidence_bytes": 4997,
      "evidence_sha256": "25fffc8d6402174dd603a8c098c1554a9173fe0e884d7e41615d37b4e8f22725",
      "manual_evidence_bytes": null,
      "manual_evidence_sha256": null,
      "manual_reason": "No manual intervention is defined for deterministic capability inventory normalization.",
      "manual_satisfied": true,
      "manual_state": "none",
      "source": "docs/roadmap/R9_3_ACCEPTANCE.md",
      "status": "pass",
      "subdivision": "R9.3"
    },
    {
      "accepted_head": "e158fd643ecf55a1ed9022193a48d2d1ee1716ed",
      "evidence_bytes": 4995,
      "evidence_sha256": "559489da2132c90d9573c825c012745112ce1a3a7e28c096645bb64325253707",
      "manual_evidence_bytes": null,
      "manual_evidence_sha256": null,
      "manual_reason": "No manual intervention is defined for workflow catalog validation and governed model resolution.",
      "manual_satisfied": true,
      "manual_state": "none",
      "source": "docs/roadmap/R9_4_ACCEPTANCE.md",
      "status": "pass",
      "subdivision": "R9.4"
    },
    {
      "accepted_head": "525a4c48ae0ff714fe4b3ee7bca34b2e8c62c112",
      "evidence_bytes": 7672,
      "evidence_sha256": "75d8f9258aec063cf3a43e3483592fd2f46cce415c4ca3d075d9f8852b47fa5c",
      "manual_evidence_bytes": null,
      "manual_evidence_sha256": null,
      "manual_reason": "The R9.5 conditional was not triggered; hosted queue/history fixtures exercised execution and reconciliation without a new authoritative local path.",
      "manual_satisfied": true,
      "manual_state": "conditional_not_triggered",
      "source": "docs/roadmap/R9_5_ACCEPTANCE.md",
      "status": "pass",
      "subdivision": "R9.5"
    },
    {
      "accepted_head": "f453db0c5ec5705b4dea8ae00a5937583f466fa1",
      "evidence_bytes": 4346,
      "evidence_sha256": "0c322836366ac093862895cfc28de239cd2ae634c70a9b0f5e3b856f29fa79cd",
      "manual_evidence_bytes": null,
      "manual_evidence_sha256": null,
      "manual_reason": "No manual intervention is defined for deterministic generated-output capture and R8 lineage bridging.",
      "manual_satisfied": true,
      "manual_state": "none",
      "source": "docs/roadmap/R9_6_ACCEPTANCE.md",
      "status": "pass",
      "subdivision": "R9.6"
    },
    {
      "accepted_head": "20cc4bbc93e547fac9fee28d7be44268358d29e4",
      "evidence_bytes": 3592,
      "evidence_sha256": "f742e01dda49e84c1332e27f0966f3edd1c8a2bc0b07238aa868b158f88063aa",
      "manual_evidence_bytes": null,
      "manual_evidence_sha256": null,
      "manual_reason": "No manual intervention is defined for targeted lifecycle and conservative free-memory semantics.",
      "manual_satisfied": true,
      "manual_state": "none",
      "source": "docs/roadmap/R9_7_ACCEPTANCE.md",
      "status": "pass",
      "subdivision": "R9.7"
    },
    {
      "accepted_head": "86777ddc7a87ad6041ddc599e20e93af38512a19",
      "evidence_bytes": 7526,
      "evidence_sha256": "4a889755fa212d1c53a5865a2ead9b0bef5c76eb7bcc3ab9198b464e16db113c",
      "manual_evidence_bytes": 5744,
      "manual_evidence_sha256": "a8412a92ea2d1f456fdc3fdf47aa1a3ac63257a69df8854d36162128e6f0a967",
      "manual_reason": "The frozen REQUIRED local GPU acceptance was reviewed and satisfied on the accepted implementation head.",
      "manual_satisfied": true,
      "manual_state": "required_satisfied",
      "source": "docs/roadmap/R9_8_ACCEPTANCE.md",
      "status": "pass",
      "subdivision": "R9.8"
    },
    {
      "accepted_head": "85f8aacf8baf0f8dba6d28ba07fcfc0dbc37a324",
      "evidence_bytes": 5762,
      "evidence_sha256": "af4b1ce571f7bf3a1d0cc87406cd90e87b092520e3e8266df07a696b275bc314",
      "manual_evidence_bytes": null,
      "manual_evidence_sha256": null,
      "manual_reason": "The R9.9 conditional was not triggered because the mandatory production packs introduced no new real node/model family beyond accepted R9.8 evidence.",
      "manual_satisfied": true,
      "manual_state": "conditional_not_triggered",
      "source": "docs/roadmap/R9_9_ACCEPTANCE.md",
      "status": "pass",
      "subdivision": "R9.9"
    },
    {
      "accepted_head": "dda09a1728ba63640f68a979af57d70f12b4c603",
      "evidence_bytes": 7957,
      "evidence_sha256": "579f2cc8b54ae930059d53185cdff33d61888cb7bfb43a24c5d4008a6f194d28",
      "manual_evidence_bytes": null,
      "manual_evidence_sha256": null,
      "manual_reason": "No manual intervention is defined for the governed CLI and non-blocking KodeStudio façade.",
      "manual_satisfied": true,
      "manual_state": "none",
      "source": "docs/roadmap/R9_10_ACCEPTANCE.md",
      "status": "pass",
      "subdivision": "R9.10"
    },
    {
      "accepted_head": "e8e7e83c107bdb8bcb29882936720bc9eeb1c246",
      "evidence_bytes": 7771,
      "evidence_sha256": "3b068614452bd9ac70b1324fc97b2dac65201ecd5d6c2af53a49a582489a1187",
      "manual_evidence_bytes": null,
      "manual_evidence_sha256": null,
      "manual_reason": "The R9.11 conditional was not triggered because adversarial hardening changes no hardware-facing semantics and inherited manual gates are resolved.",
      "manual_satisfied": true,
      "manual_state": "conditional_not_triggered",
      "source": "docs/roadmap/R9_11_ACCEPTANCE.md",
      "status": "pass",
      "subdivision": "R9.11"
    }
  ]
}
